{
  "run_id": "accept-e3-s2-prd-1772617413391",
  "scenario": "real_dev",
  "stage": "prd",
  "phase_score": 80,
  "phase_weight": 0.2,
  "check_items": [
    {
      "item_id": "prd_traceability_req_id",
      "passed": false,
      "score_delta": -5,
      "note": "部分需求缺少唯一ID"
    },
    {
      "item_id": "prd_req_completeness_boundary",
      "passed": false,
      "score_delta": -2,
      "note": "边界条件可进一步细化"
    }
  ],
  "timestamp": "2026-03-04T09:43:33.395Z",
  "iteration_count": 0,
  "iteration_records": [],
  "first_pass": true
}