{
  "run_id": "accept-e3-s2-story-1772616210497",
  "scenario": "real_dev",
  "stage": "story",
  "phase_score": 100,
  "phase_weight": 0.2,
  "check_items": [
    {
      "item_id": "story-overall",
      "passed": true,
      "score_delta": 0,
      "note": "问题清单为空"
    }
  ],
  "timestamp": "2026-03-04T09:23:30.497Z",
  "iteration_count": 0,
  "iteration_records": [],
  "first_pass": true
}