{
  "run_id": "accept-e3-s2-arch-1772615897359",
  "scenario": "real_dev",
  "stage": "arch",
  "phase_score": 100,
  "phase_weight": 0.2,
  "check_items": [
    {
      "item_id": "arch-issue-1",
      "passed": false,
      "score_delta": -2,
      "note": "可补充更多ADR示例"
    }
  ],
  "timestamp": "2026-03-04T09:18:17.359Z",
  "iteration_count": 0,
  "iteration_records": [],
  "first_pass": true
}